"Story","Title","Result","Date","Stability","Duration (s)"
"Get All Admin","As an admin I can get all admin with valid credentials","SUCCESS","2023-12-21T10:46:19.893994+07:00[Asia/Jakarta]","0.0","7.99"
"Admin Login","As an admin I can login with valid credentials","SUCCESS","2023-12-21T10:46:28.6003217+07:00[Asia/Jakarta]","0.0","1.85"
"Register Admin","As an admin I can register with valid credentials","SUCCESS","2023-12-21T10:46:32.9149431+07:00[Asia/Jakarta]","0.0","2.84"
"OTP Admin","As an admin I can send otp with valid credentials","SUCCESS","2023-12-21T10:46:48.6635775+07:00[Asia/Jakarta]","0.0","3.48"
"OTP","As a user I can send otp with valid credentials","SUCCESS","2023-12-21T10:46:52.3815703+07:00[Asia/Jakarta]","0.0","2.93"
"Create Complaint","As a user I can create complaint with valid credentials","SUCCESS","2023-12-21T10:47:05.7906875+07:00[Asia/Jakarta]","0.0","2.26"
"Create Complaint","As a user I can not create complaint with invalid ID","SUCCESS","2023-12-21T10:47:08.9220704+07:00[Asia/Jakarta]","0.0","1.37"
"Create Complaint","As a user I can not create complaint without title","SUCCESS","2023-12-21T10:47:10.3239351+07:00[Asia/Jakarta]","0.0","1.56"
"Create Complaint","As a user I can not create complaint without content","SUCCESS","2023-12-21T10:47:11.892149+07:00[Asia/Jakarta]","0.0","1.31"
